<?xml version="1.0" encoding="UTF-8" standalone="no" ?>
<room xmlns:xsi="http://www.w3.org/2001/XMLSchema-instance" xsi:noNamespaceSchemaLocation="room.xsd">

  <name>blacktooth/blacktooth05.xml</name>

  <scenery>blacktooth</scenery>

  <xTiles>3</xTiles>

  <yTiles>10</yTiles>

  <width>16</width>

  <floorType>regular</floorType>

  <floor>
    <tile>
      <x>0</x>
      <y>4</y>
      <offsetX>0</offsetX>
      <offsetY>0</offsetY>
      <bitmap>gfx/blacktooth.png/blacktooth-floor-north.png</bitmap>
    </tile>
    <tile>
      <x>0</x>
      <y>5</y>
      <offsetX>0</offsetX>
      <offsetY>0</offsetY>
      <bitmap>gfx/blacktooth.png/blacktooth-floor-north.png</bitmap>
    </tile>
    <tile>
      <x>1</x>
      <y>0</y>
      <offsetX>0</offsetX>
      <offsetY>0</offsetY>
      <bitmap>gfx/blacktooth.png/blacktooth-floor-east.png</bitmap>
    </tile>
    <tile>
      <x>2</x>
      <y>0</y>
      <offsetX>0</offsetX>
      <offsetY>0</offsetY>
      <bitmap>gfx/blacktooth.png/blacktooth-floor-east.png</bitmap>
    </tile>
    <tile>
      <x>1</x>
      <y>9</y>
      <offsetX>0</offsetX>
      <offsetY>0</offsetY>
      <bitmap>gfx/blacktooth.png/blacktooth-floor-west.png</bitmap>
    </tile>
    <tile>
      <x>2</x>
      <y>9</y>
      <offsetX>0</offsetX>
      <offsetY>0</offsetY>
      <bitmap>gfx/blacktooth.png/blacktooth-floor-west.png</bitmap>
    </tile>
    <tile>
      <x>1</x>
      <y>1</y>
      <offsetX>0</offsetX>
      <offsetY>0</offsetY>
      <bitmap>gfx/blacktooth.png/blacktooth-floor.png</bitmap>
    </tile>
    <tile>
      <x>1</x>
      <y>2</y>
      <offsetX>0</offsetX>
      <offsetY>0</offsetY>
      <bitmap>gfx/blacktooth.png/blacktooth-floor.png</bitmap>
    </tile>
    <tile>
      <x>1</x>
      <y>3</y>
      <offsetX>0</offsetX>
      <offsetY>0</offsetY>
      <bitmap>gfx/blacktooth.png/blacktooth-floor.png</bitmap>
    </tile>
    <tile>
      <x>1</x>
      <y>4</y>
      <offsetX>0</offsetX>
      <offsetY>0</offsetY>
      <bitmap>gfx/blacktooth.png/blacktooth-floor.png</bitmap>
    </tile>
    <tile>
      <x>1</x>
      <y>5</y>
      <offsetX>0</offsetX>
      <offsetY>0</offsetY>
      <bitmap>gfx/blacktooth.png/blacktooth-floor.png</bitmap>
    </tile>
    <tile>
      <x>1</x>
      <y>6</y>
      <offsetX>0</offsetX>
      <offsetY>0</offsetY>
      <bitmap>gfx/blacktooth.png/blacktooth-floor.png</bitmap>
    </tile>
    <tile>
      <x>1</x>
      <y>7</y>
      <offsetX>0</offsetX>
      <offsetY>0</offsetY>
      <bitmap>gfx/blacktooth.png/blacktooth-floor.png</bitmap>
    </tile>
    <tile>
      <x>1</x>
      <y>8</y>
      <offsetX>0</offsetX>
      <offsetY>0</offsetY>
      <bitmap>gfx/blacktooth.png/blacktooth-floor.png</bitmap>
    </tile>
    <tile>
      <x>2</x>
      <y>1</y>
      <offsetX>0</offsetX>
      <offsetY>0</offsetY>
      <bitmap>gfx/blacktooth.png/blacktooth-floor.png</bitmap>
    </tile>
    <tile>
      <x>2</x>
      <y>2</y>
      <offsetX>0</offsetX>
      <offsetY>0</offsetY>
      <bitmap>gfx/blacktooth.png/blacktooth-floor.png</bitmap>
    </tile>
    <tile>
      <x>2</x>
      <y>3</y>
      <offsetX>0</offsetX>
      <offsetY>0</offsetY>
      <bitmap>gfx/blacktooth.png/blacktooth-floor.png</bitmap>
    </tile>
    <tile>
      <x>2</x>
      <y>4</y>
      <offsetX>0</offsetX>
      <offsetY>0</offsetY>
      <bitmap>gfx/blacktooth.png/blacktooth-floor.png</bitmap>
    </tile>
    <tile>
      <x>2</x>
      <y>5</y>
      <offsetX>0</offsetX>
      <offsetY>0</offsetY>
      <bitmap>gfx/blacktooth.png/blacktooth-floor.png</bitmap>
    </tile>
    <tile>
      <x>2</x>
      <y>6</y>
      <offsetX>0</offsetX>
      <offsetY>0</offsetY>
      <bitmap>gfx/blacktooth.png/blacktooth-floor.png</bitmap>
    </tile>
    <tile>
      <x>2</x>
      <y>7</y>
      <offsetX>0</offsetX>
      <offsetY>0</offsetY>
      <bitmap>gfx/blacktooth.png/blacktooth-floor.png</bitmap>
    </tile>
    <tile>
      <x>2</x>
      <y>8</y>
      <offsetX>0</offsetX>
      <offsetY>0</offsetY>
      <bitmap>gfx/blacktooth.png/blacktooth-floor.png</bitmap>
    </tile>
  </floor>

  <items>
    <item x="0" y="1" z="0">
      <label>211</label>
      <direction>none</direction>
      <behavior>0</behavior>
      <type>griditem</type>
    </item>
    <item x="0" y="2" z="0">
      <label>213</label>
      <direction>none</direction>
      <behavior>0</behavior>
      <type>griditem</type>
    </item>
    <item x="0" y="3" z="0">
      <label>211</label>
      <direction>none</direction>
      <behavior>0</behavior>
      <type>griditem</type>
    </item>
    <item x="0" y="6" z="0">
      <label>211</label>
      <direction>none</direction>
      <behavior>0</behavior>
      <type>griditem</type>
    </item>
    <item x="0" y="7" z="0">
      <label>213</label>
      <direction>none</direction>
      <behavior>0</behavior>
      <type>griditem</type>
    </item>
    <item x="0" y="8" z="0">
      <label>211</label>
      <direction>none</direction>
      <behavior>0</behavior>
      <type>griditem</type>
    </item>
    <item x="0" y="4" z="-1">
      <label>2011</label>
      <direction>north</direction>
      <behavior>0</behavior>
      <type>door</type>
    </item>
    <item x="1" y="0" z="-1">
      <label>5011</label>
      <direction>east</direction>
      <behavior>0</behavior>
      <type>door</type>
    </item>
    <item x="1" y="9" z="-1">
      <label>5011</label>
      <direction>west</direction>
      <behavior>0</behavior>
      <type>door</type>
    </item>
    <item x="1" y="6" z="0">
      <label>4</label>
      <direction>none</direction>
      <behavior>0</behavior>
      <type>griditem</type>
    </item>
    <item x="2" y="6" z="0">
      <label>4</label>
      <direction>none</direction>
      <behavior>0</behavior>
      <type>griditem</type>
    </item>
  </items>

</room>
