<?xml version="1.0" encoding="UTF-8" standalone="no" ?>
<room xmlns:xsi="http://www.w3.org/2001/XMLSchema-instance" xsi:noNamespaceSchemaLocation="room.xsd">

  <name>safari/safari08.xml</name>

  <scenery>safari</scenery>

  <xTiles>10</xTiles>

  <yTiles>2</yTiles>

  <width>16</width>

  <floorType>regular</floorType>

  <floor>
    <tile>
      <x>0</x>
      <y>0</y>
      <offsetX>0</offsetX>
      <offsetY>0</offsetY>
      <bitmap>gfx/safari.png/safari-floor-north.png</bitmap>
    </tile>
    <tile>
      <x>0</x>
      <y>1</y>
      <offsetX>0</offsetX>
      <offsetY>0</offsetY>
      <bitmap>gfx/safari.png/safari-floor-north.png</bitmap>
    </tile>
    <tile>
      <x>9</x>
      <y>0</y>
      <offsetX>0</offsetX>
      <offsetY>0</offsetY>
      <bitmap>gfx/safari.png/safari-floor-south.png</bitmap>
    </tile>
    <tile>
      <x>9</x>
      <y>1</y>
      <offsetX>0</offsetX>
      <offsetY>0</offsetY>
      <bitmap>gfx/safari.png/safari-floor-south.png</bitmap>
    </tile>
    <tile>
      <x>1</x>
      <y>0</y>
      <offsetX>0</offsetX>
      <offsetY>0</offsetY>
      <bitmap>gfx/safari.png/safari-floor.png</bitmap>
    </tile>
    <tile>
      <x>1</x>
      <y>1</y>
      <offsetX>0</offsetX>
      <offsetY>0</offsetY>
      <bitmap>gfx/safari.png/safari-floor.png</bitmap>
    </tile>
    <tile>
      <x>2</x>
      <y>0</y>
      <offsetX>0</offsetX>
      <offsetY>0</offsetY>
      <bitmap>gfx/safari.png/safari-floor.png</bitmap>
    </tile>
    <tile>
      <x>2</x>
      <y>1</y>
      <offsetX>0</offsetX>
      <offsetY>0</offsetY>
      <bitmap>gfx/safari.png/safari-floor.png</bitmap>
    </tile>
    <tile>
      <x>3</x>
      <y>0</y>
      <offsetX>0</offsetX>
      <offsetY>0</offsetY>
      <bitmap>gfx/safari.png/safari-floor.png</bitmap>
    </tile>
    <tile>
      <x>3</x>
      <y>1</y>
      <offsetX>0</offsetX>
      <offsetY>0</offsetY>
      <bitmap>gfx/safari.png/safari-floor.png</bitmap>
    </tile>
    <tile>
      <x>4</x>
      <y>0</y>
      <offsetX>0</offsetX>
      <offsetY>0</offsetY>
      <bitmap>gfx/safari.png/safari-floor.png</bitmap>
    </tile>
    <tile>
      <x>4</x>
      <y>1</y>
      <offsetX>0</offsetX>
      <offsetY>0</offsetY>
      <bitmap>gfx/safari.png/safari-floor.png</bitmap>
    </tile>
    <tile>
      <x>5</x>
      <y>0</y>
      <offsetX>0</offsetX>
      <offsetY>0</offsetY>
      <bitmap>gfx/safari.png/safari-floor.png</bitmap>
    </tile>
    <tile>
      <x>5</x>
      <y>1</y>
      <offsetX>0</offsetX>
      <offsetY>0</offsetY>
      <bitmap>gfx/safari.png/safari-floor.png</bitmap>
    </tile>
    <tile>
      <x>6</x>
      <y>0</y>
      <offsetX>0</offsetX>
      <offsetY>0</offsetY>
      <bitmap>gfx/safari.png/safari-floor.png</bitmap>
    </tile>
    <tile>
      <x>6</x>
      <y>1</y>
      <offsetX>0</offsetX>
      <offsetY>0</offsetY>
      <bitmap>gfx/safari.png/safari-floor.png</bitmap>
    </tile>
    <tile>
      <x>7</x>
      <y>0</y>
      <offsetX>0</offsetX>
      <offsetY>0</offsetY>
      <bitmap>gfx/safari.png/safari-floor.png</bitmap>
    </tile>
    <tile>
      <x>7</x>
      <y>1</y>
      <offsetX>0</offsetX>
      <offsetY>0</offsetY>
      <bitmap>gfx/safari.png/safari-floor.png</bitmap>
    </tile>
    <tile>
      <x>8</x>
      <y>0</y>
      <offsetX>0</offsetX>
      <offsetY>0</offsetY>
      <bitmap>gfx/safari.png/safari-floor.png</bitmap>
    </tile>
    <tile>
      <x>8</x>
      <y>1</y>
      <offsetX>0</offsetX>
      <offsetY>0</offsetY>
      <bitmap>gfx/safari.png/safari-floor.png</bitmap>
    </tile>
  </floor>

  <walls>
    <wall>
      <axis>x</axis>
      <index>1</index>
      <bitmap>gfx/safari.png/safari-wall-x-1.png</bitmap>
    </wall>
    <wall>
      <axis>x</axis>
      <index>2</index>
      <bitmap>gfx/safari.png/safari-wall-x-3.png</bitmap>
    </wall>
    <wall>
      <axis>x</axis>
      <index>3</index>
      <bitmap>gfx/safari.png/safari-wall-x-1.png</bitmap>
    </wall>
    <wall>
      <axis>x</axis>
      <index>4</index>
      <bitmap>gfx/safari.png/safari-wall-x-2.png</bitmap>
    </wall>
    <wall>
      <axis>x</axis>
      <index>5</index>
      <bitmap>gfx/safari.png/safari-wall-x-2.png</bitmap>
    </wall>
    <wall>
      <axis>x</axis>
      <index>6</index>
      <bitmap>gfx/safari.png/safari-wall-x-1.png</bitmap>
    </wall>
    <wall>
      <axis>x</axis>
      <index>7</index>
      <bitmap>gfx/safari.png/safari-wall-x-3.png</bitmap>
    </wall>
    <wall>
      <axis>x</axis>
      <index>8</index>
      <bitmap>gfx/safari.png/safari-wall-x-1.png</bitmap>
    </wall>
  </walls>

  <items>
    <item x="0" y="0" z="-1">
      <label>307</label>
      <direction>none</direction>
      <behavior>0</behavior>
      <type>griditem</type>
    </item>
    <item x="0" y="1" z="-1">
      <label>307</label>
      <direction>none</direction>
      <behavior>0</behavior>
      <type>griditem</type>
    </item>
    <item x="0" y="0" z="-1">
      <label>3077</label>
      <direction>north</direction>
      <behavior>0</behavior>
      <type>door</type>
    </item>
    <item x="9" y="0" z="0">
      <label>310</label>
      <direction>none</direction>
      <behavior>0</behavior>
      <type>griditem</type>
    </item>
    <item x="9" y="1" z="0">
      <label>310</label>
      <direction>none</direction>
      <behavior>0</behavior>
      <type>griditem</type>
    </item>
    <item x="9" y="0" z="-1">
      <label>3077</label>
      <direction>south</direction>
      <behavior>0</behavior>
      <type>door</type>
    </item>
  </items>

</room>
